{
  "schema_version": "0.1",
  "module_id": "FAC_INSTITUTIONAL_GENERIC_001",
  "display_name": "Institutional Facade Bay — Generic Prototype",
  "description": "Bay modular de fachada institucional com aberturas e ancoragem para protecao climatica.",
  "status": "hypothesis",
  "slot_code": "FAC",
  "module_type": "institutional_facade_bay",
  "lod_support": [
    1,
    2,
    3
  ],
  "base_weight": 1,
  "tags": [
    "facade",
    "institutional",
    "generic_prototype"
  ],
  "capabilities": [
    "window_opening_capable",
    "door_opening_capable",
    "climate_control_anchor_capable",
    "signage_anchor_capable"
  ],
  "geometry": {
    "width_units": {
      "min": 1,
      "max": 6
    },
    "height_units": {
      "min": 1,
      "max": 4
    },
    "depth_units": {
      "min": 0.1,
      "max": 0.6
    },
    "repeatable_axes": [
      "x",
      "y"
    ],
    "mirror_allowed": true,
    "rotation_steps": [
      0,
      90,
      180,
      270
    ]
  },
  "sockets": [
    {
      "socket_id": "structure_inner",
      "interface": "structure_to_facade",
      "role": "consumer",
      "normal": "inward",
      "required": true,
      "capacity": 1
    },
    {
      "socket_id": "window_opening",
      "interface": "opening_window",
      "role": "provider",
      "normal": "outward",
      "required": true,
      "capacity": 8
    },
    {
      "socket_id": "door_opening",
      "interface": "opening_door",
      "role": "provider",
      "normal": "outward",
      "required": true,
      "capacity": 4
    },
    {
      "socket_id": "shade_anchor",
      "interface": "climate_control_anchor",
      "role": "provider",
      "normal": "outward",
      "required": false,
      "capacity": 8
    },
    {
      "socket_id": "signage_anchor",
      "interface": "signage_anchor",
      "role": "provider",
      "normal": "outward",
      "required": false,
      "capacity": 4
    }
  ],
  "material_refs": [
    {
      "role": "surface",
      "allowed_material_ids": [
        "MAT_MASONRY_DENSE_GENERIC_001",
        "MAT_PANEL_LIGHT_GENERIC_001"
      ],
      "required": true
    }
  ],
  "compatibility": {
    "archetype_ids": [
      "BLD_INS_HOSPITAL",
      "BLD_INS_SCHOOL_SMALL",
      "BLD_INS_CLINIC_SMALL"
    ],
    "usage": [
      "institutional"
    ],
    "height_classes": [
      "SINGLE_STOREY",
      "LOW_RISE",
      "MID_RISE"
    ],
    "tech_levels": [
      "vernacular",
      "craft",
      "early_industrial",
      "industrial",
      "mass_produced",
      "prefabricated",
      "digital_fabrication",
      "advanced"
    ],
    "max_floor_count": 12
  },
  "parameters": {
    "opening_ratio": {
      "min": 0.1,
      "max": 0.6
    }
  }
}
