{
  "schema_version": "0.1",
  "module_id": "WIN_INSTITUTIONAL_GENERIC_001",
  "display_name": "Institutional Window — Generic Prototype",
  "description": "Janela modular generica para fachadas institucionais com ventilacao e protecao solar opcionais.",
  "status": "hypothesis",
  "slot_code": "WIN",
  "module_type": "institutional_window",
  "lod_support": [
    1,
    2,
    3
  ],
  "base_weight": 1,
  "tags": [
    "window",
    "institutional",
    "generic_prototype"
  ],
  "capabilities": [
    "natural_ventilation_capable",
    "sun_protection_capable"
  ],
  "geometry": {
    "width_units": {
      "min": 0.5,
      "max": 3
    },
    "height_units": {
      "min": 0.5,
      "max": 2.5
    },
    "depth_units": {
      "min": 0.05,
      "max": 0.4
    },
    "repeatable_axes": [
      "x"
    ],
    "mirror_allowed": true,
    "rotation_steps": [
      0,
      90,
      180,
      270
    ]
  },
  "sockets": [
    {
      "socket_id": "facade_opening",
      "interface": "opening_window",
      "role": "consumer",
      "normal": "inward",
      "required": true,
      "capacity": 1
    }
  ],
  "material_refs": [],
  "compatibility": {
    "archetype_ids": [
      "BLD_INS_HOSPITAL",
      "BLD_INS_SCHOOL_SMALL",
      "BLD_INS_CLINIC_SMALL"
    ],
    "usage": [
      "institutional"
    ],
    "height_classes": [
      "SINGLE_STOREY",
      "LOW_RISE",
      "MID_RISE"
    ],
    "tech_levels": [
      "vernacular",
      "craft",
      "early_industrial",
      "industrial",
      "mass_produced",
      "prefabricated",
      "digital_fabrication",
      "advanced"
    ],
    "max_floor_count": 12
  },
  "parameters": {
    "sun_protection": true,
    "operable_area_ratio": {
      "min": 0.2,
      "max": 0.9
    }
  }
}
