{
  "schema_version": "0.1",
  "module_id": "ROF_FLAT_UNCERTIFIED_GENERIC_001",
  "display_name": "Uncertified Flat Roof — Negative Control",
  "description": "Candidato de teste sem capacidade de drenagem comprovada; deve falhar quando a diretiva a exigir.",
  "status": "hypothesis",
  "slot_code": "ROF",
  "module_type": "flat_roof_unverified",
  "lod_support": [1, 2],
  "base_weight": 1.0,
  "tags": ["roof", "flat", "unverified_performance", "generic_prototype"],
  "capabilities": ["weather_enclosure_capable"],
  "geometry": {
    "width_units": {"min": 3, "max": 14},
    "height_units": {"min": 0.2, "max": 1},
    "depth_units": {"min": 4, "max": 18},
    "repeatable_axes": ["x", "z"],
    "mirror_allowed": true,
    "rotation_steps": [0, 90, 180, 270]
  },
  "sockets": [
    {"socket_id": "structure_bottom", "interface": "structure_to_roof", "role": "consumer", "normal": "down", "required": true, "capacity": 1}
  ],
  "material_refs": [
    {"role": "surface", "allowed_material_ids": ["MAT_SURFACE_NEUTRAL_GENERIC_001"], "required": true}
  ],
  "compatibility": {
    "archetype_ids": ["BLD_RES_HOUSE_DETACHED"],
    "usage": ["residential"],
    "height_classes": ["SINGLE_STOREY", "LOW_RISE"],
    "tech_levels": ["early_industrial", "industrial", "mass_produced", "prefabricated"],
    "max_floor_count": 4
  },
  "parameters": {
    "roof_overhang": {"min": 0, "max": 0.1},
    "drainage_system": "unverified",
    "slope_class": "flat"
  },
  "notes": "Existe apenas como controle negativo do filtro de capability."
}
