{
  "schema_version": "0.1",
  "module_id": "STR_FRAME_LOWRISE_GENERIC_001",
  "display_name": "Low-rise Frame — Generic Prototype",
  "description": "Estrutura modular generica que conecta fundacao, paredes, fachada, cobertura e equipamento.",
  "status": "hypothesis",
  "slot_code": "STR",
  "module_type": "lowrise_frame",
  "lod_support": [1, 2, 3],
  "base_weight": 1.0,
  "tags": ["structure", "lowrise", "frame", "generic_prototype"],
  "capabilities": ["four_storey_support_capable", "facade_anchor_capable", "roof_support_capable"],
  "geometry": {
    "width_units": {"min": 3, "max": 14},
    "height_units": {"min": 1, "max": 4},
    "depth_units": {"min": 4, "max": 18},
    "repeatable_axes": ["x", "y", "z"],
    "mirror_allowed": true,
    "rotation_steps": [0, 90, 180, 270]
  },
  "sockets": [
    {"socket_id": "foundation_bottom", "interface": "foundation_to_structure", "role": "consumer", "normal": "down", "required": true, "capacity": 1},
    {"socket_id": "wall_anchor", "interface": "structure_to_wall", "role": "provider", "normal": "outward", "required": true, "capacity": 4},
    {"socket_id": "facade_anchor", "interface": "structure_to_facade", "role": "provider", "normal": "outward", "required": true, "capacity": 4},
    {"socket_id": "roof_top", "interface": "structure_to_roof", "role": "provider", "normal": "up", "required": true, "capacity": 1},
    {"socket_id": "technical_anchor", "interface": "technical_anchor", "role": "provider", "normal": "up", "required": false, "capacity": 2}
  ],
  "material_refs": [
    {"role": "primary", "allowed_material_ids": ["MAT_MASONRY_DENSE_GENERIC_001"], "required": true}
  ],
  "compatibility": {
    "archetype_ids": ["BLD_RES_HOUSE_DETACHED"],
    "usage": ["residential"],
    "height_classes": ["SINGLE_STOREY", "LOW_RISE"],
    "tech_levels": ["craft", "early_industrial", "industrial", "mass_produced", "prefabricated", "digital_fabrication", "advanced"],
    "max_floor_count": 4
  },
  "parameters": {"floor_capacity": {"min": 1, "max": 4}}
}
